title,author,file
The Book of Joy: Lasting Happiness in a Changing World,Dalai Lama XIV,/Volumes/sambashare/Sorted Media/Audiobooks/Sorted/Non Fiction/the_book_of_joy_lasting_happiness_in_a_changing_world/the_book_of_joy_lasting_happiness_in_a_changing_world.mp3
The Secret Lives of Introverts: Inside Our Hidden World,Jenn Granneman,/Volumes/sambashare/Sorted Media/Audiobooks/Sorted/Non Fiction/the_secret_lives_of_introverts_inside_our_hidden_world/the_secret_lives_of_introverts_inside_our_hidden_world.mp3
Find Your Why: A Practical Guide to Discovering Purpose for You and Your Team,Simon Sinek,/Volumes/sambashare/Sorted Media/Audiobooks/Sorted/Non Fiction/find_your_why_a_practical_guide_to_discovering_purpose_for_you_and_your_team/find_your_why_a_practical_guide_to_discovering_purpose_for_you_and_your_team.mp3
"Outrage, Inc.: How the Liberal Mob Ruined Science, Journalism, and Hollywood",Derek  Hunter,/Volumes/sambashare/Sorted Media/Audiobooks/Sorted/Non Fiction/outrage_inc._how_the_liberal_mob_ruined_science_journalism_and_hollywood/outrage_inc._how_the_liberal_mob_ruined_science_journalism_and_hollywood.mp3
Blink: The Power of Thinking Without Thinking,Malcolm Gladwell,/Volumes/sambashare/Sorted Media/Audiobooks/Sorted/Non Fiction/blink_the_power_of_thinking_without_thinking/blink_the_power_of_thinking_without_thinking.mp3
Anything You Want,Derek Sivers,/Volumes/sambashare/Sorted Media/Audiobooks/Sorted/Non Fiction/anything_you_want/anything_you_want.mp3
The Effective Executive: The Definitive Guide to Getting the Right Things Done,Peter F. Drucker,/Volumes/sambashare/Sorted Media/Audiobooks/Sorted/Non Fiction/the_effective_executive_the_definitive_guide_to_getting_the_right_things_done/the_effective_executive_the_definitive_guide_to_getting_the_right_things_done.mp3
Maps of Meaning: The Architecture of Belief,Jordan B. Peterson,/Volumes/sambashare/Sorted Media/Audiobooks/Sorted/Non Fiction/maps_of_meaning_the_architecture_of_belief/maps_of_meaning_the_architecture_of_belief.mp3
The Almost Nearly Perfect People: Behind the Myth of the Scandinavian Utopia,Michael Booth,/Volumes/sambashare/Sorted Media/Audiobooks/Sorted/Non Fiction/the_almost_nearly_perfect_people_behind_the_myth_of_the_scandinavian_utopia/the_almost_nearly_perfect_people_behind_the_myth_of_the_scandinavian_utopia.mp3
Ego Is the Enemy,Ryan Holiday,/Volumes/sambashare/Sorted Media/Audiobooks/Sorted/Non Fiction/ego_is_the_enemy/ego_is_the_enemy.mp3
A Brief History of Time,Stephen Hawking,/Volumes/sambashare/Sorted Media/Audiobooks/Sorted/Non Fiction/a_brief_history_of_time/a_brief_history_of_time.mp3
"The Innovators: How a Group of  Hackers, Geniuses and Geeks Created the Digital Revolution",Walter Isaacson,/Volumes/sambashare/Sorted Media/Audiobooks/Sorted/Non Fiction/the_innovators_how_a_group_of__hackers_geniuses_and_geeks_created_the_digital_revolution/the_innovators_how_a_group_of__hackers_geniuses_and_geeks_created_the_digital_revolution.mp3
The 4-Hour Workweek,Timothy Ferriss,/Volumes/sambashare/Sorted Media/Audiobooks/Sorted/Non Fiction/the_4hour_workweek/the_4hour_workweek.mp3
Capital in the Twenty-First Century,Thomas Piketty,/Volumes/sambashare/Sorted Media/Audiobooks/Sorted/Non Fiction/capital_in_the_twentyfirst_century/capital_in_the_twentyfirst_century.mp3
Algorithms to Live By: The Computer Science of Human Decisions,Brian Christian,/Volumes/sambashare/Sorted Media/Audiobooks/Sorted/Non Fiction/algorithms_to_live_by_the_computer_science_of_human_decisions/algorithms_to_live_by_the_computer_science_of_human_decisions.mp3
"The Awakened Ape: A Biohacker's Guide to Evolutionary Fitness, Natural Ecstasy, and Stress-Free Living",Jevan Pradas,/Volumes/sambashare/Sorted Media/Audiobooks/Sorted/Non Fiction/the_awakened_ape_a_biohackers_guide_to_evolutionary_fitness_natural_ecstasy_and_stressfree_living/the_awakened_ape_a_biohackers_guide_to_evolutionary_fitness_natural_ecstasy_and_stressfree_living.mp3
Predictably Irrational: The Hidden Forces That Shape Our Decisions,Dan Ariely,/Volumes/sambashare/Sorted Media/Audiobooks/Sorted/Non Fiction/predictably_irrational_the_hidden_forces_that_shape_our_decisions/predictably_irrational_the_hidden_forces_that_shape_our_decisions.mp3
The Selfish Gene,Richard Dawkins,/Volumes/sambashare/Sorted Media/Audiobooks/Sorted/Non Fiction/the_selfish_gene/the_selfish_gene.mp3
How to Be a Stoic: Using Ancient Philosophy to Live a Modern Life,Massimo Pigliucci,/Volumes/sambashare/Sorted Media/Audiobooks/Sorted/Non Fiction/how_to_be_a_stoic_using_ancient_philosophy_to_live_a_modern_life/how_to_be_a_stoic_using_ancient_philosophy_to_live_a_modern_life.mp3
Originals: How Non-Conformists Move the World,Adam M. Grant,/Volumes/sambashare/Sorted Media/Audiobooks/Sorted/Non Fiction/originals_how_nonconformists_move_the_world/originals_how_nonconformists_move_the_world.mp3
Born a Crime: Stories From a South African Childhood,Trevor Noah,/Volumes/sambashare/Sorted Media/Audiobooks/Sorted/Non Fiction/born_a_crime_stories_from_a_south_african_childhood/born_a_crime_stories_from_a_south_african_childhood.mp3
The 7 Habits of Highly Effective People,Stephen R Covey,/Volumes/sambashare/Sorted Media/Audiobooks/Sorted/Non Fiction/the_7_habits_of_highly_effective_people/the_7_habits_of_highly_effective_people.mp3
The 10x Rule: The Only Difference Between Success and Failure,Grant Cardone,/Volumes/sambashare/Sorted Media/Audiobooks/Sorted/Non Fiction/the_10x_rule_the_only_difference_between_success_and_failure/the_10x_rule_the_only_difference_between_success_and_failure.mp3
Stoicism: A Stoic Approach To Modern Life,Tom Miles,/Volumes/sambashare/Sorted Media/Audiobooks/Sorted/Non Fiction/stoicism_a_stoic_approach_to_modern_life/stoicism_a_stoic_approach_to_modern_life.mp3
Hackers: Heroes of the Computer Revolution,Steven Levy,/Volumes/sambashare/Sorted Media/Audiobooks/Sorted/Non Fiction/hackers_heroes_of_the_computer_revolution/hackers_heroes_of_the_computer_revolution.mp3
The Elephant in the Brain,Kevin Simler,/Volumes/sambashare/Sorted Media/Audiobooks/Sorted/Non Fiction/the_elephant_in_the_brain/the_elephant_in_the_brain.mp3
Waking Up: A Guide to Spirituality Without Religion,Sam Harris,/Volumes/sambashare/Sorted Media/Audiobooks/Sorted/Non Fiction/waking_up_a_guide_to_spirituality_without_religion/waking_up_a_guide_to_spirituality_without_religion.mp3
"SuperFreakonomics: Global Cooling, Patriotic Prostitutes And Why Suicide Bombers Should Buy Life Insurance",Steven D. Levitt,/Volumes/sambashare/Sorted Media/Audiobooks/Sorted/Non Fiction/superfreakonomics_global_cooling_patriotic_prostitutes_and_why_suicide_bombers_should_buy_life_insurance/superfreakonomics_global_cooling_patriotic_prostitutes_and_why_suicide_bombers_should_buy_life_insurance.mp3
How Google Works,Eric Schmidt,/Volumes/sambashare/Sorted Media/Audiobooks/Sorted/Non Fiction/how_google_works/how_google_works.mp3
The Tipping Point: How Little Things Can Make a Big Difference,Malcolm Gladwell,/Volumes/sambashare/Sorted Media/Audiobooks/Sorted/Non Fiction/the_tipping_point_how_little_things_can_make_a_big_difference/the_tipping_point_how_little_things_can_make_a_big_difference.mp3
The Happiness Hypothesis: Finding Modern Truth in Ancient Wisdom,Jonathan Haidt,/Volumes/sambashare/Sorted Media/Audiobooks/Sorted/Non Fiction/the_happiness_hypothesis_finding_modern_truth_in_ancient_wisdom/the_happiness_hypothesis_finding_modern_truth_in_ancient_wisdom.mp3
Principles: Life and Work,Ray Dalio,/Volumes/sambashare/Sorted Media/Audiobooks/Sorted/Non Fiction/principles_life_and_work/principles_life_and_work.mp3
Astrophysics for People in a Hurry,Neil deGrasse Tyson,/Volumes/sambashare/Sorted Media/Audiobooks/Sorted/Non Fiction/astrophysics_for_people_in_a_hurry/astrophysics_for_people_in_a_hurry.mp3
The Laws of Human Nature,Robert Greene,/Volumes/sambashare/Sorted Media/Audiobooks/Sorted/Non Fiction/the_laws_of_human_nature/the_laws_of_human_nature.mp3
Money and Power: How Goldman Sachs Came to Rule the World,William D. Cohan,/Volumes/sambashare/Sorted Media/Audiobooks/Sorted/Non Fiction/money_and_power_how_goldman_sachs_came_to_rule_the_world/money_and_power_how_goldman_sachs_came_to_rule_the_world.mp3
The Consolations of Philosophy,Alain de Botton,/Volumes/sambashare/Sorted Media/Audiobooks/Sorted/Non Fiction/the_consolations_of_philosophy/the_consolations_of_philosophy.mp3
The Five Dysfunctions of a Team: A Leadership Fable,Patrick Lencioni,/Volumes/sambashare/Sorted Media/Audiobooks/Sorted/Non Fiction/the_five_dysfunctions_of_a_team_a_leadership_fable/the_five_dysfunctions_of_a_team_a_leadership_fable.mp3
The Little Book of Common Sense Investing: The Only Way to Guarantee Your Fair Share of Stock Market Returns,John C. Bogle,/Volumes/sambashare/Sorted Media/Audiobooks/Sorted/Non Fiction/the_little_book_of_common_sense_investing_the_only_way_to_guarantee_your_fair_share_of_stock_market_returns/the_little_book_of_common_sense_investing_the_only_way_to_guarantee_your_fair_share_of_stock_market_returns.mp3
The Innovator's Dilemma: The Revolutionary Book that Will Change the Way You Do Business,Clayton M. Christensen,/Volumes/sambashare/Sorted Media/Audiobooks/Sorted/Non Fiction/the_innovators_dilemma_the_revolutionary_book_that_will_change_the_way_you_do_business/the_innovators_dilemma_the_revolutionary_book_that_will_change_the_way_you_do_business.mp3
Chaos: Making a New Science,James Gleick,/Volumes/sambashare/Sorted Media/Audiobooks/Sorted/Non Fiction/chaos_making_a_new_science/chaos_making_a_new_science.mp3
The Millionaire Mind,Thomas J. Stanley,/Volumes/sambashare/Sorted Media/Audiobooks/Sorted/Non Fiction/the_millionaire_mind/the_millionaire_mind.mp3
The 48 Laws of Power,Robert Greene,/Volumes/sambashare/Sorted Media/Audiobooks/Sorted/Non Fiction/the_48_laws_of_power/the_48_laws_of_power.mp3
Big Magic: Creative Living Beyond Fear,Elizabeth Gilbert,/Volumes/sambashare/Sorted Media/Audiobooks/Sorted/Non Fiction/big_magic_creative_living_beyond_fear/big_magic_creative_living_beyond_fear.mp3
Why We Sleep: Unlocking the Power of Sleep and Dreams,Matthew Walker,/Volumes/sambashare/Sorted Media/Audiobooks/Sorted/Non Fiction/why_we_sleep_unlocking_the_power_of_sleep_and_dreams/why_we_sleep_unlocking_the_power_of_sleep_and_dreams.mp3
Behave: The Biology of Humans at Our Best and Worst,Robert M. Sapolsky,/Volumes/sambashare/Sorted Media/Audiobooks/Sorted/Non Fiction/behave_the_biology_of_humans_at_our_best_and_worst/behave_the_biology_of_humans_at_our_best_and_worst.mp3
The Quiet Rise of Introverts: The 8 Practices for Loving and Living in a Noisy World,Brenda Knowles,/Volumes/sambashare/Sorted Media/Audiobooks/Sorted/Non Fiction/the_quiet_rise_of_introverts_the_8_practices_for_loving_and_living_in_a_noisy_world/the_quiet_rise_of_introverts_the_8_practices_for_loving_and_living_in_a_noisy_world.mp3
"Blockchain Revolution: How the Technology Behind Bitcoin Is Changing Money, Business, and the World",Don Tapscott,/Volumes/sambashare/Sorted Media/Audiobooks/Sorted/Non Fiction/blockchain_revolution_how_the_technology_behind_bitcoin_is_changing_money_business_and_the_world/blockchain_revolution_how_the_technology_behind_bitcoin_is_changing_money_business_and_the_world.mp3
The Obstacle Is the Way: The Timeless Art of Turning Trials into Triumph,Ryan Holiday,/Volumes/sambashare/Sorted Media/Audiobooks/Sorted/Non Fiction/the_obstacle_is_the_way_the_timeless_art_of_turning_trials_into_triumph/the_obstacle_is_the_way_the_timeless_art_of_turning_trials_into_triumph.mp3
Smarter Faster Better: The Secrets of Being Productive in Life and Business,Charles Duhigg,/Volumes/sambashare/Sorted Media/Audiobooks/Sorted/Non Fiction/smarter_faster_better_the_secrets_of_being_productive_in_life_and_business/smarter_faster_better_the_secrets_of_being_productive_in_life_and_business.mp3
World Without Mind: The Existential Threat of Big Tech,Franklin Foer,/Volumes/sambashare/Sorted Media/Audiobooks/Sorted/Non Fiction/world_without_mind_the_existential_threat_of_big_tech/world_without_mind_the_existential_threat_of_big_tech.mp3
A Whole New Mind: Why Right-Brainers Will Rule the Future,Daniel H. Pink,/Volumes/sambashare/Sorted Media/Audiobooks/Sorted/Non Fiction/a_whole_new_mind_why_rightbrainers_will_rule_the_future/a_whole_new_mind_why_rightbrainers_will_rule_the_future.mp3
Start with Why: How Great Leaders Inspire Everyone to Take Action,Simon Sinek,/Volumes/sambashare/Sorted Media/Audiobooks/Sorted/Non Fiction/start_with_why_how_great_leaders_inspire_everyone_to_take_action/start_with_why_how_great_leaders_inspire_everyone_to_take_action.mp3
A Slip of the Keyboard,Terry Pratchett,/Volumes/sambashare/Sorted Media/Audiobooks/Sorted/Non Fiction/a_slip_of_the_keyboard/a_slip_of_the_keyboard.mp3
Payoff: The Hidden Logic That Shapes Our Motivations,Dan Ariely,/Volumes/sambashare/Sorted Media/Audiobooks/Sorted/Non Fiction/payoff_the_hidden_logic_that_shapes_our_motivations/payoff_the_hidden_logic_that_shapes_our_motivations.mp3
The Gifts of Imperfection: Let Go of Who You Think You're Supposed to Be and Embrace Who You Are,Brené Brown,/Volumes/sambashare/Sorted Media/Audiobooks/Sorted/Non Fiction/the_gifts_of_imperfection_let_go_of_who_you_think_youre_supposed_to_be_and_embrace_who_you_are/the_gifts_of_imperfection_let_go_of_who_you_think_youre_supposed_to_be_and_embrace_who_you_are.mp3
The Checklist Manifesto: How to Get Things Right,Atul Gawande,/Volumes/sambashare/Sorted Media/Audiobooks/Sorted/Non Fiction/the_checklist_manifesto_how_to_get_things_right/the_checklist_manifesto_how_to_get_things_right.mp3
All You Want To Know About Giants Of Philosophy: All You Want To Know Series,Knowledge Products,/Volumes/sambashare/Sorted Media/Audiobooks/Sorted/Non Fiction/all_you_want_to_know_about_giants_of_philosophy_all_you_want_to_know_series/all_you_want_to_know_about_giants_of_philosophy_all_you_want_to_know_series.mp3
The Black Swan: The Impact of the Highly Improbable,Nassim Nicholas Taleb,/Volumes/sambashare/Sorted Media/Audiobooks/Sorted/Non Fiction/the_black_swan_the_impact_of_the_highly_improbable/the_black_swan_the_impact_of_the_highly_improbable.mp3
"The Four: The Hidden DNA of Amazon, Apple, Facebook, and Google",Scott Galloway,/Volumes/sambashare/Sorted Media/Audiobooks/Sorted/Non Fiction/the_four_the_hidden_dna_of_amazon_apple_facebook_and_google/the_four_the_hidden_dna_of_amazon_apple_facebook_and_google.mp3
"The Productivity Project: Accomplishing More by Managing Your Time, Attention, and Energy",Chris   Bailey,/Volumes/sambashare/Sorted Media/Audiobooks/Sorted/Non Fiction/the_productivity_project_accomplishing_more_by_managing_your_time_attention_and_energy/the_productivity_project_accomplishing_more_by_managing_your_time_attention_and_energy.mp3
Outliers: The Story of Success,Malcolm Gladwell,/Volumes/sambashare/Sorted Media/Audiobooks/Sorted/Non Fiction/outliers_the_story_of_success/outliers_the_story_of_success.mp3
Switch: How to Change Things When Change Is Hard,Chip Heath,/Volumes/sambashare/Sorted Media/Audiobooks/Sorted/Non Fiction/switch_how_to_change_things_when_change_is_hard/switch_how_to_change_things_when_change_is_hard.mp3
Meditation for Fidgety Skeptics: A 10% Happier How-to Book,Dan   Harris,/Volumes/sambashare/Sorted Media/Audiobooks/Sorted/Non Fiction/meditation_for_fidgety_skeptics_a_10_happier_howto_book/meditation_for_fidgety_skeptics_a_10_happier_howto_book.mp3
Life 3.0: Being Human in the Age of Artificial Intelligence,Max Tegmark,/Volumes/sambashare/Sorted Media/Audiobooks/Sorted/Non Fiction/life_3.0_being_human_in_the_age_of_artificial_intelligence/life_3.0_being_human_in_the_age_of_artificial_intelligence.mp3
Work Rules!: Insights from Inside Google That Will Transform How You Live and Lead,Laszlo Bock,/Volumes/sambashare/Sorted Media/Audiobooks/Sorted/Non Fiction/work_rules_insights_from_inside_google_that_will_transform_how_you_live_and_lead/work_rules_insights_from_inside_google_that_will_transform_how_you_live_and_lead.mp3
Stoicism: The Philosophy Of Calmness,George Muntau,/Volumes/sambashare/Sorted Media/Audiobooks/Sorted/Non Fiction/stoicism_the_philosophy_of_calmness/stoicism_the_philosophy_of_calmness.mp3
"Why Nations Fail: The Origins of Power, Prosperity, and Poverty",Daron Acemoğlu,/Volumes/sambashare/Sorted Media/Audiobooks/Sorted/Non Fiction/why_nations_fail_the_origins_of_power_prosperity_and_poverty/why_nations_fail_the_origins_of_power_prosperity_and_poverty.mp3
Brave New World,Aldous Huxley,/Volumes/sambashare/Sorted Media/Audiobooks/Sorted/Non Fiction/brave_new_world/brave_new_world.mp3
The Truth: An Uncomfortable Book About Relationships,Neil Strauss,/Volumes/sambashare/Sorted Media/Audiobooks/Sorted/Non Fiction/the_truth_an_uncomfortable_book_about_relationships/the_truth_an_uncomfortable_book_about_relationships.mp3
Robin,Dave Itzkoff,/Volumes/sambashare/Sorted Media/Audiobooks/Sorted/Non Fiction/robin/robin.mp3
Think Like a Freak,Steven D. Levitt,/Volumes/sambashare/Sorted Media/Audiobooks/Sorted/Non Fiction/think_like_a_freak/think_like_a_freak.mp3
Braving the Wilderness: The Quest for True Belonging and the Courage to Stand Alone,Brené Brown,/Volumes/sambashare/Sorted Media/Audiobooks/Sorted/Non Fiction/braving_the_wilderness_the_quest_for_true_belonging_and_the_courage_to_stand_alone/braving_the_wilderness_the_quest_for_true_belonging_and_the_courage_to_stand_alone.mp3
"Scale: The Universal Laws of Growth, Innovation, Sustainability, and the Pace of Life in Organisms, Cities, Economies, and Companies",Geoffrey West,/Volumes/sambashare/Sorted Media/Audiobooks/Sorted/Non Fiction/scale_the_universal_laws_of_growth_innovation_sustainability_and_the_pace_of_life_in_organisms_cities_economies_and_companies/scale_the_universal_laws_of_growth_innovation_sustainability_and_the_pace_of_life_in_organisms_cities_economies_and_companies.mp3
Essentialism: The Disciplined Pursuit of Less,Greg McKeown,/Volumes/sambashare/Sorted Media/Audiobooks/Sorted/Non Fiction/essentialism_the_disciplined_pursuit_of_less/essentialism_the_disciplined_pursuit_of_less.mp3
Success Through Stillness: Meditation Made Simple,Russell Simmons,/Volumes/sambashare/Sorted Media/Audiobooks/Sorted/Non Fiction/success_through_stillness_meditation_made_simple/success_through_stillness_meditation_made_simple.mp3
21 Lessons for the 21st Century,Yuval Noah Harari,/Volumes/sambashare/Sorted Media/Audiobooks/Sorted/Non Fiction/21_lessons_for_the_21st_century/21_lessons_for_the_21st_century.mp3
Leaders Eat Last,Simon Sinek,/Volumes/sambashare/Sorted Media/Audiobooks/Sorted/Non Fiction/leaders_eat_last/leaders_eat_last.mp3
"Everybody Lies: Big Data, New Data, and What the Internet Can Tell Us About Who We Really Are",Seth Stephens-Davidowitz,/Volumes/sambashare/Sorted Media/Audiobooks/Sorted/Non Fiction/everybody_lies_big_data_new_data_and_what_the_internet_can_tell_us_about_who_we_really_are/everybody_lies_big_data_new_data_and_what_the_internet_can_tell_us_about_who_we_really_are.mp3
Treasure Islands: Uncovering the Damage of Offshore Banking and Tax Havens,Nicholas Shaxson,/Volumes/sambashare/Sorted Media/Audiobooks/Sorted/Non Fiction/treasure_islands_uncovering_the_damage_of_offshore_banking_and_tax_havens/treasure_islands_uncovering_the_damage_of_offshore_banking_and_tax_havens.mp3
Happy: Why More or Less Everything is Absolutely Fine,Derren Brown,/Volumes/sambashare/Sorted Media/Audiobooks/Sorted/Non Fiction/happy_why_more_or_less_everything_is_absolutely_fine/happy_why_more_or_less_everything_is_absolutely_fine.mp3
Skin in the Game: The Hidden Asymmetries in Daily Life,Nassim Nicholas Taleb,/Volumes/sambashare/Sorted Media/Audiobooks/Sorted/Non Fiction/skin_in_the_game_the_hidden_asymmetries_in_daily_life/skin_in_the_game_the_hidden_asymmetries_in_daily_life.mp3
Tribes: We Need You to Lead Us,Seth Godin,/Volumes/sambashare/Sorted Media/Audiobooks/Sorted/Non Fiction/tribes_we_need_you_to_lead_us/tribes_we_need_you_to_lead_us.mp3
"Freakonomics: A Rogue Economist Explores the Hidden Side of Everything (Freakonomics, #1)",Steven D. Levitt,/Volumes/sambashare/Sorted Media/Audiobooks/Sorted/Non Fiction/freakonomics_a_rogue_economist_explores_the_hidden_side_of_everything_freakonomics_1/freakonomics_a_rogue_economist_explores_the_hidden_side_of_everything_freakonomics_1.mp3
The Hero With a Thousand Faces,Joseph Campbell,/Volumes/sambashare/Sorted Media/Audiobooks/Sorted/Non Fiction/the_hero_with_a_thousand_faces/the_hero_with_a_thousand_faces.mp3
Science in the Soul: Selected Writings of a Passionate Rationalist,Richard Dawkins,/Volumes/sambashare/Sorted Media/Audiobooks/Sorted/Non Fiction/science_in_the_soul_selected_writings_of_a_passionate_rationalist/science_in_the_soul_selected_writings_of_a_passionate_rationalist.mp3
Inside the Middle East: Making Sense of the Most Dangerous and Complicated Region on Earth,Avi Melamed,/Volumes/sambashare/Sorted Media/Audiobooks/Sorted/Non Fiction/inside_the_middle_east_making_sense_of_the_most_dangerous_and_complicated_region_on_earth/inside_the_middle_east_making_sense_of_the_most_dangerous_and_complicated_region_on_earth.mp3
Think and Grow Rich,Napoleon Hill,/Volumes/sambashare/Sorted Media/Audiobooks/Sorted/Non Fiction/think_and_grow_rich/think_and_grow_rich.mp3
Captivate: The Science of Succeeding with People,Vanessa Van Edwards,/Volumes/sambashare/Sorted Media/Audiobooks/Sorted/Non Fiction/captivate_the_science_of_succeeding_with_people/captivate_the_science_of_succeeding_with_people.mp3
The Universe in a Nutshell,Stephen Hawking,/Volumes/sambashare/Sorted Media/Audiobooks/Sorted/Non Fiction/the_universe_in_a_nutshell/the_universe_in_a_nutshell.mp3
"David and Goliath: Underdogs, Misfits, and the Art of Battling Giants",Malcolm Gladwell,/Volumes/sambashare/Sorted Media/Audiobooks/Sorted/Non Fiction/david_and_goliath_underdogs_misfits_and_the_art_of_battling_giants/david_and_goliath_underdogs_misfits_and_the_art_of_battling_giants.mp3
Dare to Lead: Brave Work. Tough Conversations. Whole Hearts.,Brené Brown,/Volumes/sambashare/Sorted Media/Audiobooks/Sorted/Non Fiction/DZ8EOD~6/dare_to_lead_brave_work._tough_conversations._whole_hearts..mp3
The 5 Elements of Effective Thinking,Edward B. Burger,/Volumes/sambashare/Sorted Media/Audiobooks/Sorted/Non Fiction/the_5_elements_of_effective_thinking/the_5_elements_of_effective_thinking.mp3
The Everything Store: Jeff Bezos and the Age of Amazon,Brad Stone,/Volumes/sambashare/Sorted Media/Audiobooks/Sorted/Non Fiction/the_everything_store_jeff_bezos_and_the_age_of_amazon/the_everything_store_jeff_bezos_and_the_age_of_amazon.mp3
"The Chimp Paradox: The Acclaimed Mind Management Programme to Help You Achieve Success, Confidence and Happiness",Steve Peters,/Volumes/sambashare/Sorted Media/Audiobooks/Sorted/Non Fiction/the_chimp_paradox_the_acclaimed_mind_management_programme_to_help_you_achieve_success_confidence_and_happiness/the_chimp_paradox_the_acclaimed_mind_management_programme_to_help_you_achieve_success_confidence_and_happiness.mp3
Unlimited Power: The New Science Of Personal Achievement,Anthony Robbins,/Volumes/sambashare/Sorted Media/Audiobooks/Sorted/Non Fiction/unlimited_power_the_new_science_of_personal_achievement/unlimited_power_the_new_science_of_personal_achievement.mp3
,,/Volumes/sambashare/Sorted Media/Audiobooks/Sorted/Non Fiction/unlimited_power_the_new_science_of_personal_achievement/Unlimited power a-book audio cd.mp3
12 Rules for Life: An Antidote to Chaos,Jordan B. Peterson,/Volumes/sambashare/Sorted Media/Audiobooks/Sorted/Non Fiction/12_rules_for_life_an_antidote_to_chaos/12_rules_for_life_an_antidote_to_chaos.mp3
Dreams from My Father: A Story of Race and Inheritance,Barack Obama,/Volumes/sambashare/Sorted Media/Audiobooks/Sorted/Non Fiction/dreams_from_my_father_a_story_of_race_and_inheritance/dreams_from_my_father_a_story_of_race_and_inheritance.mp3
Scrum: The Art of Doing Twice the Work in Half the Time,Jeff Sutherland,/Volumes/sambashare/Sorted Media/Audiobooks/Sorted/Non Fiction/scrum_the_art_of_doing_twice_the_work_in_half_the_time/scrum_the_art_of_doing_twice_the_work_in_half_the_time.mp3
"Games People Play: Game Theory in Life, Business, and Beyond",Scott P. Stevens,/Volumes/sambashare/Sorted Media/Audiobooks/Sorted/Non Fiction/games_people_play_game_theory_in_life_business_and_beyond/games_people_play_game_theory_in_life_business_and_beyond.mp3
Aware: The Science and Practice of Presence--A Complete Guide to the Groundbreaking Wheel of Awareness Meditation Practice,Daniel J. Siegel,/Volumes/sambashare/Sorted Media/Audiobooks/Sorted/Non Fiction/aware_the_science_and_practice_of_presencea_complete_guide_to_the_groundbreaking_wheel_of_awareness_meditation_practice/aware_the_science_and_practice_of_presencea_complete_guide_to_the_groundbreaking_wheel_of_awareness_meditation_practice.mp3
"A Troublesome Inheritance: Genes, Race and Human History",Nicholas J. Wade,/Volumes/sambashare/Sorted Media/Audiobooks/Sorted/Non Fiction/a_troublesome_inheritance_genes_race_and_human_history/a_troublesome_inheritance_genes_race_and_human_history.mp3
Bad Blood: Secrets and Lies in a Silicon Valley Startup,John Carreyrou,/Volumes/sambashare/Sorted Media/Audiobooks/Sorted/Non Fiction/bad_blood_secrets_and_lies_in_a_silicon_valley_startup/bad_blood_secrets_and_lies_in_a_silicon_valley_startup.mp3
"Crushing It!: How Great Entrepreneurs Build Their Business and Influence—and How You Can, Too",Gary Vaynerchuk,/Volumes/sambashare/Sorted Media/Audiobooks/Sorted/Non Fiction/crushing_it_how_great_entrepreneurs_build_their_business_and_influenceand_how_you_can_too/crushing_it_how_great_entrepreneurs_build_their_business_and_influenceand_how_you_can_too.mp3
Radical Candor: Be a Kickass Boss Without Losing Your Humanity,Kim Malone Scott,/Volumes/sambashare/Sorted Media/Audiobooks/Sorted/Non Fiction/radical_candor_be_a_kickass_boss_without_losing_your_humanity/radical_candor_be_a_kickass_boss_without_losing_your_humanity.mp3
